{
  "arguments_digest": "sha256:b8893e25ad51147216d879ad93d670f09f575a43253e9511c04ace125cfe2e6e",
  "capability_id": "fin.mcp.initialize",
  "content_type": "text/event-stream",
  "deployment_id": "dep-datvbjflk1mc73d3pitg",
  "endpoint_url": "https://fin-data-mcp-http-v02-prod.onrender.com/mcp",
  "http_status": 200,
  "isError": false,
  "pagination_complete": true,
  "permit_id": "fdp-3a3807c466cd4a6c82ba3b3cfa9b0b71",
  "protocol_method": "initialize",
  "raw_response_digest": "sha256:64276c3ab01ce722153ce93ea78553f9dcd21f53d50ba16f94f17e191425a95b",
  "received_at": "2026-09-30T03:29:07.136Z",
  "request_id": "fin-38656a56506042d1a4a04035e30310ce",
  "requested_at": "2026-09-30T03:29:04.484Z",
  "result": {
    "capabilities": {
      "resources": {
        "listChanged": true
      },
      "tools": {
        "listChanged": true
      }
    },
    "instructions": "fin-data-mcp-server provides read-only access to free financial\nmarket data across 13 categories: stocks, indices, options, forex, commodities,\ncrypto (spot + perpetual futures), energy, prediction markets, market-moving news/\nfilings, macroeconomics, alternative data (flights), sentiment, and congressional\ntrading.\n\nConventions:\n- Tools are prefixed by domain: yahoo_* and cboe_* (equities/indices/options),\n  crypto_* (OKX spot+perps), fx_* (FX), worldbank_*/oecd_*/dbnomics_* (macro),\n  sec_* (filings), kalshi_*/polymarket_*/manifold_* (prediction markets),\n  flights_* (OpenSky), congress_* (lawmaker trades), energy_* (Ember),\n  tiingo_* (premium equities), crypto_fear_greed_index (sentiment).\n- Equities have two independent backends: yahoo_* (primary) and cboe_* (no-key\n  delayed quotes incl. options + long history). Prefer cboe_* if Yahoo is throttled.\n- All responses are compact JSON and are truncated past ~25k chars \u2014 use limit/\n  offset/date bounds to narrow large queries.\n- Most tools need no configuration. Optional env: SEC_USER_AGENT (recommended for\n  sec_*), EMBER_API_KEY, TIINGO_API_KEY, OPENSKY_CLIENT_ID/SECRET.",
    "protocolVersion": "2024-11-05",
    "serverInfo": {
      "name": "fin-data-mcp-server",
      "version": "0.2.0"
    }
  },
  "schema_version": "1.0",
  "source_id": "fin_data_mcp_render_prod",
  "tool_name": "initialize"
}
