{
  "arguments_digest": "sha256:562c74bf4d94a2ee42fc8f477e26cfa89c12640881ea605f30b1dac4407f3731",
  "capability_id": "fin.crypto.candles",
  "content_type": "text/event-stream",
  "deployment_id": "dep-datvbjflk1mc73d3pitg",
  "endpoint_url": "https://fin-data-mcp-http-v02-prod.onrender.com/mcp",
  "http_status": 200,
  "isError": false,
  "pagination_complete": true,
  "permit_id": "fdp-40c8025e26a94b439d21783174015c9b",
  "protocol_method": "tools/call",
  "raw_response_digest": "sha256:d93f958331bb4e02e599738df4a13da45863151349dc78b3a8f7918bfce036fe",
  "received_at": "2026-09-30T03:55:36.686Z",
  "request_id": "fin-204c8dba15bb4a768dc2cd97c624eee7",
  "requested_at": "2026-09-30T03:55:33.543Z",
  "result": {
    "content": [
      {
        "text": "[\n  [\n    \"1790740500000\",\n    \"83322.1\",\n    \"83331.7\",\n    \"83307.6\",\n    \"83311.1\",\n    \"1.78566361\",\n    \"148796.650157972\",\n    \"148796.650157972\",\n    \"0\"\n  ],\n  [\n    \"1790740440000\",\n    \"83292\",\n    \"83322.1\",\n    \"83292\",\n    \"83320.1\",\n    \"0.13427964\",\n    \"11186.26790876\",\n    \"11186.26790876\",\n    \"1\"\n  ],\n  [\n    \"1790740380000\",\n    \"83296.3\",\n    \"83312.1\",\n    \"83283.5\",\n    \"83291.9\",\n    \"2.0408473\",\n    \"169986.99155217\",\n    \"169986.99155217\",\n    \"1\"\n  ]\n]",
        "type": "text"
      }
    ],
    "structuredContent": {
      "data": [
        [
          "1790740500000",
          "83322.1",
          "83331.7",
          "83307.6",
          "83311.1",
          "1.78566361",
          "148796.650157972",
          "148796.650157972",
          "0"
        ],
        [
          "1790740440000",
          "83292",
          "83322.1",
          "83292",
          "83320.1",
          "0.13427964",
          "11186.26790876",
          "11186.26790876",
          "1"
        ],
        [
          "1790740380000",
          "83296.3",
          "83312.1",
          "83283.5",
          "83291.9",
          "2.0408473",
          "169986.99155217",
          "169986.99155217",
          "1"
        ]
      ]
    }
  },
  "schema_version": "1.0",
  "source_id": "fin_data_mcp_render_prod",
  "tool_name": "crypto_candles"
}
