{
  "arguments_digest": "sha256:8db0af46f77f5896f3ceba52e79ba56b0ba93fb9715392fecd826907076fb6f3",
  "capability_id": "fin.crypto.funding",
  "content_type": "text/event-stream",
  "deployment_id": "dep-datvbjflk1mc73d3pitg",
  "endpoint_url": "https://fin-data-mcp-http-v02-prod.onrender.com/mcp",
  "http_status": 200,
  "isError": false,
  "pagination_complete": true,
  "permit_id": "fdp-c2932cef322d46c6b95db378f44c07d1",
  "protocol_method": "tools/call",
  "raw_response_digest": "sha256:280e4237841c27905637ce81d151b5b119b3a3c1c3a5e891173818771516fbab",
  "received_at": "2026-09-30T03:14:59.400Z",
  "request_id": "fin-94daf401534749689c67222521e95e8c",
  "requested_at": "2026-09-30T03:14:56.108Z",
  "result": {
    "content": [
      {
        "text": "[\n  {\n    \"formulaType\": \"withRate\",\n    \"fundingRate\": \"0.0000366051151360\",\n    \"fundingTime\": \"1790755200000\",\n    \"impactValue\": \"20000.0000000000000000\",\n    \"instId\": \"BTC-USDT-SWAP\",\n    \"instType\": \"SWAP\",\n    \"interestRate\": \"0.0001000000000000\",\n    \"maxFundingRate\": \"0.00375\",\n    \"method\": \"current_period\",\n    \"minFundingRate\": \"-0.00375\",\n    \"nextFundingRate\": \"\",\n    \"nextFundingTime\": \"1790784000000\",\n    \"premium\": \"-0.0004703663217712\",\n    \"prevFundingTime\": \"1790726400000\",\n    \"settFundingRate\": \"0.0001000000000000\",\n    \"settState\": \"settled\",\n    \"ts\": \"1790738043059\"\n  }\n]",
        "type": "text"
      }
    ],
    "structuredContent": {
      "data": [
        {
          "formulaType": "withRate",
          "fundingRate": "0.0000366051151360",
          "fundingTime": "1790755200000",
          "impactValue": "20000.0000000000000000",
          "instId": "BTC-USDT-SWAP",
          "instType": "SWAP",
          "interestRate": "0.0001000000000000",
          "maxFundingRate": "0.00375",
          "method": "current_period",
          "minFundingRate": "-0.00375",
          "nextFundingRate": "",
          "nextFundingTime": "1790784000000",
          "premium": "-0.0004703663217712",
          "prevFundingTime": "1790726400000",
          "settFundingRate": "0.0001000000000000",
          "settState": "settled",
          "ts": "1790738043059"
        }
      ]
    }
  },
  "schema_version": "1.0",
  "source_id": "fin_data_mcp_render_prod",
  "tool_name": "crypto_funding_rate"
}
