{
  "arguments_digest": "sha256:0e8c53d52ea723373f4d90ebdf5ff053055fad51c5f0391d8a41b488d0520277",
  "capability_id": "fin.crypto.orderbook",
  "content_type": "text/event-stream",
  "deployment_id": "dep-datvbjflk1mc73d3pitg",
  "endpoint_url": "https://fin-data-mcp-http-v02-prod.onrender.com/mcp",
  "http_status": 200,
  "isError": false,
  "pagination_complete": true,
  "permit_id": "fdp-5101e9d07a4845feb30992de8676bd4d",
  "protocol_method": "tools/call",
  "raw_response_digest": "sha256:23a42bd3a26f503c445a8d1497e4f1ddb8bf0ba012fc4707b2fd65304ebddc17",
  "received_at": "2026-09-30T03:55:28.996Z",
  "request_id": "fin-339401728fef41eebe1a88921fced671",
  "requested_at": "2026-09-30T03:55:25.826Z",
  "result": {
    "content": [
      {
        "text": "[\n  {\n    \"asks\": [\n      [\n        \"83268.1\",\n        \"1292.82\",\n        \"0\",\n        \"55\"\n      ],\n      [\n        \"83268.2\",\n        \"0.02\",\n        \"0\",\n        \"2\"\n      ],\n      [\n        \"83268.4\",\n        \"0.02\",\n        \"0\",\n        \"1\"\n      ],\n      [\n        \"83268.5\",\n        \"16.84\",\n        \"0\",\n        \"1\"\n      ],\n      [\n        \"83268.7\",\n        \"0.01\",\n        \"0\",\n        \"1\"\n      ]\n    ],\n    \"bids\": [\n      [\n        \"83268\",\n        \"452.58\",\n        \"0\",\n        \"22\"\n      ],\n      [\n        \"83267.9\",\n        \"0.81\",\n        \"0\",\n        \"4\"\n      ],\n      [\n        \"83267.8\",\n        \"0.14\",\n        \"0\",\n        \"2\"\n      ],\n      [\n        \"83267.7\",\n        \"0.01\",\n        \"0\",\n        \"1\"\n      ],\n      [\n        \"83267.3\",\n        \"0.03\",\n        \"0\",\n        \"3\"\n      ]\n    ],\n    \"ts\": \"1790740527600\",\n    \"seqId\": 342943462308\n  }\n]",
        "type": "text"
      }
    ],
    "structuredContent": {
      "data": [
        {
          "asks": [
            [
              "83268.1",
              "1292.82",
              "0",
              "55"
            ],
            [
              "83268.2",
              "0.02",
              "0",
              "2"
            ],
            [
              "83268.4",
              "0.02",
              "0",
              "1"
            ],
            [
              "83268.5",
              "16.84",
              "0",
              "1"
            ],
            [
              "83268.7",
              "0.01",
              "0",
              "1"
            ]
          ],
          "bids": [
            [
              "83268",
              "452.58",
              "0",
              "22"
            ],
            [
              "83267.9",
              "0.81",
              "0",
              "4"
            ],
            [
              "83267.8",
              "0.14",
              "0",
              "2"
            ],
            [
              "83267.7",
              "0.01",
              "0",
              "1"
            ],
            [
              "83267.3",
              "0.03",
              "0",
              "3"
            ]
          ],
          "seqId": 342943462308,
          "ts": "1790740527600"
        }
      ]
    }
  },
  "schema_version": "1.0",
  "source_id": "fin_data_mcp_render_prod",
  "tool_name": "crypto_orderbook"
}
