{
  "arguments_digest": "sha256:2308586f8a0ec7357228d27b0e0a6cd75e53068a0520f1ef35cd66a57a7c17a1",
  "capability_id": "fin.crypto.mark_price",
  "content_type": "text/event-stream",
  "deployment_id": "dep-datvbjflk1mc73d3pitg",
  "endpoint_url": "https://fin-data-mcp-http-v02-prod.onrender.com/mcp",
  "http_status": 200,
  "isError": false,
  "pagination_complete": true,
  "permit_id": "fdp-7e0043ce5a8a4c86a60c8f7affaea0db",
  "raw_response_digest": "sha256:784ce37cc65527e733782755939ab8b4ab8116d4ec9f8fbd978be62eef7bca9f",
  "received_at": "2026-09-30T02:42:55.570Z",
  "request_id": "fin-176460d8c1cc4146bde9e5a1a2391110",
  "requested_at": "2026-09-30T02:42:52.242Z",
  "result": {
    "content": [
      {
        "text": "[\n  {\n    \"instId\": \"BTC-USDT-SWAP\",\n    \"instType\": \"SWAP\",\n    \"markPx\": \"83331.1\",\n    \"ts\": \"1790736174135\"\n  }\n]",
        "type": "text"
      }
    ],
    "structuredContent": {
      "data": [
        {
          "instId": "BTC-USDT-SWAP",
          "instType": "SWAP",
          "markPx": "83331.1",
          "ts": "1790736174135"
        }
      ]
    }
  },
  "schema_version": "1.0",
  "source_id": "fin_data_mcp_render_prod",
  "tool_name": "crypto_mark_price"
}
