{
  "arguments_digest": "sha256:98a89d0a7c1c80e95b59fb80a2ddbfa6aed0896df69a81c912204f917b83ecd6",
  "capability_id": "fin.crypto.index_candles",
  "content_type": "text/event-stream",
  "deployment_id": "dep-datvbjflk1mc73d3pitg",
  "endpoint_url": "https://fin-data-mcp-http-v02-prod.onrender.com/mcp",
  "http_status": 200,
  "isError": false,
  "pagination_complete": true,
  "permit_id": "fdp-457283054ebc40678c7e039b8fa789d3",
  "raw_response_digest": "sha256:2726a8016c842fccb8a7594139ae6d8490075e8519c393cc24dc245fe649926e",
  "received_at": "2026-09-30T02:43:37.560Z",
  "request_id": "fin-740c200df0b844b3a9515f34b0e6f081",
  "requested_at": "2026-09-30T02:43:34.170Z",
  "result": {
    "content": [
      {
        "text": "[\n  [\n    \"1790733600000\",\n    \"83410.9\",\n    \"83582.1\",\n    \"83253.3\",\n    \"83315.4\",\n    \"0\"\n  ]\n]",
        "type": "text"
      }
    ],
    "structuredContent": {
      "data": [
        [
          "1790733600000",
          "83410.9",
          "83582.1",
          "83253.3",
          "83315.4",
          "0"
        ]
      ]
    }
  },
  "schema_version": "1.0",
  "source_id": "fin_data_mcp_render_prod",
  "tool_name": "crypto_index_candles"
}
