{
  "arguments_digest": "sha256:921a7ce3f568c22158c70d31de5264e4032e3098d3f0c606a971afcd5e672d2b",
  "capability_id": "fin.crypto.candles",
  "content_type": "text/event-stream",
  "deployment_id": "dep-datvbjflk1mc73d3pitg",
  "endpoint_url": "https://fin-data-mcp-http-v02-prod.onrender.com/mcp",
  "http_status": 200,
  "isError": false,
  "pagination_complete": true,
  "permit_id": "fdp-1ab6d0e14b694a2fa021ac734579e802",
  "raw_response_digest": "sha256:69d9ab4c07b5f29bbb5a5343ea4ac0a3e592e3818f3610cece646bbea3e5bb2d",
  "received_at": "2026-09-30T02:43:32.501Z",
  "request_id": "fin-ccf479b42b6d44db8d380ea9bad84dc6",
  "requested_at": "2026-09-30T02:43:29.356Z",
  "result": {
    "content": [
      {
        "text": "[\n  [\n    \"1790733600000\",\n    \"83404.4\",\n    \"83585.8\",\n    \"83258\",\n    \"83311\",\n    \"128885.46\",\n    \"1288.8546\",\n    \"107486000.73872\",\n    \"0\"\n  ]\n]",
        "type": "text"
      }
    ],
    "structuredContent": {
      "data": [
        [
          "1790733600000",
          "83404.4",
          "83585.8",
          "83258",
          "83311",
          "128885.46",
          "1288.8546",
          "107486000.73872",
          "0"
        ]
      ]
    }
  },
  "schema_version": "1.0",
  "source_id": "fin_data_mcp_render_prod",
  "tool_name": "crypto_candles"
}
