{
  "arguments_digest": "sha256:562c74bf4d94a2ee42fc8f477e26cfa89c12640881ea605f30b1dac4407f3731",
  "capability_id": "fin.crypto.candles",
  "content_type": "text/event-stream",
  "deployment_id": "dep-datvbjflk1mc73d3pitg",
  "endpoint_url": "https://fin-data-mcp-http-v02-prod.onrender.com/mcp",
  "http_status": 200,
  "isError": false,
  "pagination_complete": true,
  "permit_id": "fdp-a48ea039b1124368976855a15fe804e8",
  "protocol_method": "tools/call",
  "raw_response_digest": "sha256:b289ad2b1730face773520d932e69d254bb9b3440a5647e333bfefb9c15d03e7",
  "received_at": "2026-09-30T04:02:36.596Z",
  "request_id": "fin-ff422e71285d4eb690cdd995efd171c6",
  "requested_at": "2026-09-30T04:02:33.591Z",
  "result": {
    "content": [
      {
        "text": "[\n  [\n    \"1790740920000\",\n    \"83342.2\",\n    \"83380\",\n    \"83342.1\",\n    \"83380\",\n    \"0.44848206\",\n    \"37380.48063789\",\n    \"37380.48063789\",\n    \"0\"\n  ],\n  [\n    \"1790740860000\",\n    \"83336.2\",\n    \"83342.2\",\n    \"83325.8\",\n    \"83342.2\",\n    \"0.51894971\",\n    \"43248.850752328\",\n    \"43248.850752328\",\n    \"1\"\n  ],\n  [\n    \"1790740800000\",\n    \"83312.4\",\n    \"83336.3\",\n    \"83300.2\",\n    \"83332.2\",\n    \"0.94920902\",\n    \"79096.007811998\",\n    \"79096.007811998\",\n    \"1\"\n  ]\n]",
        "type": "text"
      }
    ],
    "structuredContent": {
      "data": [
        [
          "1790740920000",
          "83342.2",
          "83380",
          "83342.1",
          "83380",
          "0.44848206",
          "37380.48063789",
          "37380.48063789",
          "0"
        ],
        [
          "1790740860000",
          "83336.2",
          "83342.2",
          "83325.8",
          "83342.2",
          "0.51894971",
          "43248.850752328",
          "43248.850752328",
          "1"
        ],
        [
          "1790740800000",
          "83312.4",
          "83336.3",
          "83300.2",
          "83332.2",
          "0.94920902",
          "79096.007811998",
          "79096.007811998",
          "1"
        ]
      ]
    }
  },
  "schema_version": "1.0",
  "source_id": "fin_data_mcp_render_prod",
  "tool_name": "crypto_candles"
}
